Senator,Question,Answer
Grassley," I'll start with you.

Facebook handles extensive amounts of personal data for billions of users. A significant amount of that data is shared with third-party developers, who utilize your platform.

As of this -- early this year, you did not actively monitor whether that data was transferred by such developers to other parties. Moreover, your policies only prohibit transfers by developers to parties seeking to profit from such data.

Number one, besides Professor Kogan's transfer and now, potentially, Cubeyou, do you know of any instances where user data was improperly transferred to third party in breach of Facebook's terms? If so, how many times has that happened, and was Facebook only made aware of that transfer by some third party?

"," Mr. Chairman, thank you.

As I mentioned, we're now conducting a full investigation into every single app that had a -- access to a large amount of information, before we locked down platform to prevent developers from accessing this information around (ph) 2014.

We believe that we're going to be investigating many apps, tens of thousands of apps. And, if we find any suspicious activity, we're going to conduct a full audit of those apps to understand how they're using their data and if they're doing anything improper. If we find that they're doing anything improper, we'll ban them from Facebook and we will tell everyone affected.

As for past activity, I don't have all the examples of apps that we've banned here, but if you would like, I can have my team follow up with you after this.

"
Grassley," OK (ph).

Have you ever required an audit to ensure the deletion of improperly transferred data? And, if so, how many times?

"," Mr. Chairman, yes we have. I don't have the exact figure on how many times we have. But, overall, the way we've enforced our platform policies in the past is we have looked at patterns of how apps have used our APIs and accessed information, as well as looked into reports that people have made to us about apps that might be doing sketchy things.

Going forward, we're going to take a more proactive position on this and do much more regular stock checks and other reviews of apps, as well as increasing the amount of audits that we do. And, again, I can make sure that our team follows up with you on anything about the specific past stats (ph) that would be interesting.

"
Grassley," I was going to assume that, sitting here today, you have no idea -- and if I'm wrong on that, that you're able -- you were telling me, I think, that you're able to supply those figures to us, at least as of this point.

"," Mr. Chairman, I will have my team follow up with you on what information we have.

"
Grassley," OK, but, right now, you have no certainty of whether or not -- how much of that's going on, right? OK.

Facebook collects massive amounts of data from consumers, including content, networks, contact lists, device information, location, and information from third parties, yet your data policy is only a few pages long and provides consumers with only a few examples of what is collected and how it might be used.

The examples given emphasize benign uses, such as ""connecting with friends,"" but your policy does not give any indication for more controversial issues of such data.

My question: Why doesn't Facebook disclose to its users all the ways that data might be used by Facebook and other third parties? And what is Facebook's responsibility to inform users about that information?

"," Mr. Chairman, I believe it's important to tell people exactly how the information that they share on Facebook is going to be used. That's why, every single time you go to share something on Facebook, whether it's a photo in Facebook, or a message -- in Messenger or What's App, every single time, there's a control right there about who you're going to be sharing it with -- whether it's your friends or public or a specific group -- and you can -- you can change that and control that in line.

To your broader point about the privacy policy, this gets into an -- an issue that I -- I think we and others in the tech industry have found challenging, which is that long privacy policies are very confusing. And if you make it long and spell out all the detail, then you're probably going to reduce the percent of people who read it and make it accessible to them.

So, one of the things that -- that we've struggled with over time is to make something that is as simple as possible so people can understand it, as well as giving them controls in line in the product in the context of when they're trying to actually use them, taking into account that we don't expect that most people will want to go through and read a full legal document.

"
Nelson," Thank you, Mr. Chairman.

Yesterday when we talked, I gave the relatively harmless example that I'm communicating with my friends on Facebook and indicate that I love a certain kind of chocolate. And all of a sudden I start receiving advertisements for chocolate. What if I don't want to receive those commercial advertisements?

So your chief operating officer, Ms. Sandberg, suggested on the NBC ""Today Show"" that Facebook users who do not want their personal information used for advertising might have to pay for that protection. Pay for it.

Are you actually considering having Facebook users pay for you not to use the information?

"," Senator, people have a control over how their information is used in ads in the product today. So if you want to have an experience where your ads aren't -- aren't targeted using all the information that we have available, you can turn off third-party information.

What we found is that even though some people don't like ads, people really don't like ads that aren't relevant. And while there is some discomfort for sure with using information in making ads more relevant, the overwhelming feedback that we get from our community is that people would rather have us show relevant content there than not.

So we offer this control that -- that you're referencing. Some people use it. It's not the majority of people on Facebook. And -- and I think that that's -- that's a good level of control to offer.

I think what Sheryl was saying was that, in order to not run ads at all, we would still need some sort of business model.

"
Nelson," And that is your business model. So I take it that -- and I used the harmless example of chocolate. But if it got into more personal thing, communicating with friends, and I want to cut it off, I'm going to have to pay you in order not to send me, using my personal information, something that I don't want. That in essence is what I understood Ms. Sandberg to say. Is that correct?

"," Yes, Senator.

Although to be clear, we don't offer an option today for people to pay to not show ads. We think offering an ad-supported service is the most aligned with our mission of trying to help connect everyone in the world, because we want to offer a free service that everyone can afford.

"
Nelson," OK.

"," That's the only way that we can reach billions of people.

"
Nelson," But -- so, therefore, you consider my personally identifiable data the company's data, not my data. Is that it?

"," No, Senator. Actually, at -- the first line of our Terms of Service say that you control and own the information and content that you put on Facebook.

"
Nelson," Well, the recent scandal is obviously frustrating, not only because it affected 87 million, but because it seems to be part of a pattern of lax data practices by the company, going back years.

So, back in 2011, it was a settlement with the FTC. And, now, we discover yet another incidence where the data was failed to be protected. When you discovered that Cambridge Analytica -- that had fraudulently obtained all of this information, why didn't you inform those 87 million?

"," When we learned in 2015 that Cambridge Analytica had bought data from an app developer on Facebook that people had shared it with, we did take action.

We took down the app, and we demanded that both the app developer and Cambridge Analytica delete and stop using any data that they had. They told us that they did this. In retrospect, it was clearly a mistake to believe them...

"
Nelson," Yes.

"," ... and we should have followed up and done a full audit then. And that is not a mistake that we will make.

"
Nelson," Yes, you did that, and you apologized for it. But you didn't notify them. And do you think that you have an ethical obligation to notify 87 million Facebook users?

"," Senator, when we heard back from Cambridge Analytica that they had told us that they weren't using the data and had deleted it, we considered it a closed case. In retrospect, that was clearly a mistake.

We shouldn't have taken their word for it, and we've updated our policies and how we're going to operate the company to make sure that we don't make that mistake again.

"
Nelson," Did anybody notify the FTC?

"," No, Senator, for the same reason -- that we'd considered it a closed -- a closed case.

"
Thune," And -- and, Mr. Zuckerberg, would you that -- do that differently today, presumably? That -- in response to Senator Nelson's question...

"," Yes.

"
Thune," ... having to do it over?

This may be your first appearance before Congress, but it's not the first time that Facebook has faced tough questions about its privacy policies. Wired Magazine recently noted that you have a 14-year history of apologizing for ill-advised decisions regarding user privacy, not unlike the one that you made just now in your opening statement.

After more than a decade of promises to do better, how is today's apology different? And why should we trust Facebook to make the necessary changes to ensure user privacy and give people a clearer picture of your privacy policies?

"," Thank you, Mr. Chairman. So we have made a lot of mistakes in running the company. I think it's -- it's pretty much impossible, I -- I believe, to start a company in your dorm room and then grow it to be at the scale that we're at now without making some mistakes.

And, because our service is about helping people connect and information, those mistakes have been different in -- in how they -- we try not to make the same mistake multiple times. But in general, a lot of the mistakes are around how people connect to each other, just because of the nature of the service.

"
Thune," ... having to do it over?

This may be your first appearance before Congress, but it's not the first time that Facebook has faced tough questions about its privacy policies. Wired Magazine recently noted that you have a 14-year history of apologizing for ill-advised decisions regarding user privacy, not unlike the one that you made just now in your opening statement.

After more than a decade of promises to do better, how is today's apology different? And why should we trust Facebook to make the necessary changes to ensure user privacy and give people a clearer picture of your privacy policies?

"," Overall, I would say that we're going through a broader philosophical shift in how we approach our responsibility as a company. For the first 10 or 12 years of the company, I viewed our responsibility as primarily building tools that, if we could put those tools in people's hands, then that would empower people to do good things.

What I think we've learned now across a number of issues -- not just data privacy, but also fake news and foreign interference in elections -- is that we need to take a more proactive role and a broader view of our responsibility.

It's not enough to just build tools. We need to make sure that they're used for good. And that means that we need to now take a more active view in policing the ecosystem and in watching and kind of looking out and making sure that all of the members in our community are using these tools in a way that's going to be good and healthy.

So, at the end of the day, this is going to be something where people will measure us by our results on this. It's not that I expect anything that I say here today -- to necessarily change people's view.

But I'm committed to getting this right. And I believe that, over the coming years, once we fully work all these solutions through, people will see real differences.

"
Thune," Well -- and I'm glad that you all have gotten that message.

As we discussed in my office yesterday, the line between legitimate political discourse and hate speech can sometimes be hard to identify, and especially when you're relying on artificial intelligence and other technologies for the initial discovery.

Can you discuss what steps that Facebook currently takes when making these evaluations, the challenges that you face and any examples of where you may draw the line between what is and what is not hate speech?

"," Yes, Mr. Chairman. I'll speak to hate speech, and then I'll talk about enforcing our content policies more broadly. So -- actually, maybe, if -- if you're OK with it, I'll go in the other order.

So, from the beginning of the company in 2004 -- I started in my dorm room; it was me and my roommate. We didn't have A.I. technology that could look at the content that people were sharing. So -- so we basically had to enforce our content policies reactively.

People could share what they wanted, and then, if someone in the community found it to be offensive or against our policies, they'd flag it for us, and we'd look at it reactively. Now, increasingly, we're developing A.I. tools that can identify certain classes of bad activity proactively and flag it for our team at Facebook.

By the end of this year, by the way, we're going to have more than 20,000 people working on security and content review, working across all these things. So, when content gets flagged to us, we have those -- those people look at it. And, if it violates our policies, then we take it down.

Some problems lend themselves more easily to A.I. solutions than others. So hate speech is one of the hardest, because determining if something is hate speech is very linguistically nuanced, right?

It's -- you need to understand, you know, what is a slur and what -- whether something is hateful not just in English, but the majority of people on Facebook use it in languages that are different across the world.

Contrast that, for example, with an area like finding terrorist propaganda, which we've actually been very successful at deploying A.I. tools on already.

Today, as we sit here, 99 percent of the ISIS and Al Qaida content that we take down on Facebook, our A.I. systems flag before any human sees it. So that's a success in terms of rolling out A.I. tools that can proactively police and enforce safety across the community.

Hate speech -- I am optimistic that, over a 5 to 10-year period, we will have A.I. tools that can get into some of the nuances -- the linguistic nuances of different types of content to be more accurate in flagging things for our systems.

But, today, we're just not there on that. So a lot of this is still reactive. People flag it to us. We have people look at it. We have policies to try to make it as not subjective as possible. But, until we get it more automated, there is a higher error rate than I'm happy with.

"
Feinstein," Thanks, Mr. Chairman.

Mr. Zuckerberg, what is Facebook doing to prevent foreign actors from interfering in U.S. elections?

"," Thank you, Senator.

This is one of my top priorities in 2018 -- is to get this right. I -- one of my greatest regrets in running the company is that we were slow in identifying the Russian information operations in 2016. We expected them to do a number of more traditional cyber attacks, which we did identify and notify the campaigns that they were trying to hack into them.

But we were slow at identifying the type of -- of new information operations.

"
Feinstein," When did you identify new operations?

"," It was right around the time of the 2016 election itself. So, since then, we -- 2018 is -- is an incredibly important year for elections. Not just in -- with the U.S. midterms, but, around the world, there are important elections -- in India, in Brazil, in Mexico, in Pakistan and in Hungary, that -- we want to make sure that we do everything we can to protect the integrity of those elections.

Now, I have more confidence that we're going to get this right, because, since the 2016 election, there have been several important elections around the world where we've had a better record. There was the French presidential election. There was the German election. There was the U.S. Senate Alabama special election last year.

"
Feinstein," Explain what is better about the record.

"," So we've deployed new A.I. tools that do a better job of identifying fake accounts that may be trying to interfere in elections or spread misinformation. And, between those three elections, we were able to proactively remove tens of thousands of accounts that -- before they -- they could contribute significant harm.

And the nature of these attacks, though, is that, you know, there are people in Russia whose job it is -- is to try to exploit our systems and other internet systems, and other systems, as well.

So this is an arms race, right? I mean, they're going to keep on getting better at this, and we need to invest in keeping on getting better at this, too, which is why one of things I mentioned before is we're going to have more than 20,000 people, by the end of this year, working on security and content review across the company.

"
Feinstein," Speak for a moment about automated bots that spread disinformation. What are you doing to punish those who exploit your platform in that regard?

"," Well, you're not allowed to have a fake account on Facebook. Your content has to be authentic. So we build technical tools to try to identify when people are creating fake accounts -- especially large networks of fake accounts, like the Russians have -- in order to remove all of that content.

After the 2016 election, our top priority was protecting the integrity of other elections around the world. But, at the same time, we had a parallel effort to trace back to Russia the IRA activity -- the Internet Research Agency activity that was -- the part of the Russian government that -- that did this activity in -- in 2016.

And, just last week, we were able to determine that a number of Russian media organizations that were sanctioned by the Russian regulator were operated and controlled by this Internet Research Agency.

So we took the step last week -- that was a pretty big step for us -- of taking down sanctioned news organizations in Russia as part of an operation to remove 270 fake accounts and pages, part of their broader network in Russia, that was -- that was actually not targeting international interference as much as -- sorry, let me correct that.

It was (ph) primarily targeting -- spreading misinformation in Russia itself, as well as certain Russian-speaking neighboring countries.

"
Feinstein," How many accounts of this type have you taken down?

"," Across -- in the IRA specifically, the ones that we've pegged back to the IRA, we can identify the 470 in the American elections in the 270 that we specifically went after in Russia last week.

There were many others that our systems catch, which are more difficult to attribute specifically to Russian intelligence, but the number would be in the tens of thousands of fake accounts that we remove. And I'm happy to have my team follow up with you on more information, if that would be helpful.

"
Feinstein," Would you, please? I think this is very important.

If you knew in 2015 that Cambridge Analytica was using the information of Professor Kogan's, why didn't Facebook ban Cambridge in 2015? Why'd you wait another (ph)...

(CROSSTALK)

"," Senator, that's a -- a great question.

Cambridge Analytica wasn't using our services in 2015, as far as we can tell. So this is -- this is clearly one of the questions that I asked our team, as soon as I learned about this -- is why -- why did we wait until we found out about the reports last month to -- to ban them.

It's because, as of the time that we learned about their activity in 2015, they weren't an advertiser. They weren't running pages. So we actually had nothing to ban.

"
Grassley," No, thank you, Senator Feinstein.

Now, Senator Hatch.

SEN. ORRIN HATCH (R-UTAH): Well, in my opinion, this is the most -- this is the most intense public scrutiny I've seen for a tech-related hearing since the Microsoft hearing that -- that I chaired back in the late 1990s.

The recent stories about Cambridge Analytica and data mining on social media have raised serious concerns about consumer privacy, and, naturally, I know you understand that.

At the same time, these stories touch on the very foundation of the internet economy and the way the websites that drive our internet economy make money. Some have professed themselves shocked -- shocked that companies like Facebook and Google share user data with advertisers.

Did any of these individuals ever stop to ask themselves why Facebook and Google didn't -- don't change -- don't charge for access? Nothing in life is free. Everything involves trade-offs.

If you want something without having to pay money for it, you're going to have to pay for it in some other way, it seems to me. And that's where -- what we're seeing here.

And these great websites that don't charge for access -- they extract value in some other way. And there's nothing wrong with that, as long as they're up-front about what they're doing.

To my mind, the issue here is transparency. It's consumer choice. Do users understand what they're agreeing to -- to when they access a website or agree to terms of service? Are websites up-front about how they extract value from users, or do they hide the ball?

Do consumers have the information they need to make an informed choice regarding whether or not to visit a particular website? To my -- to my mind, these are questions that we should ask or be focusing on.

Now, Mr. Zuckerberg, I remember well your first visit to Capitol Hill, back in 2010. You spoke to the Senate Republican High-Tech Task Force, which I chair. You said back then that Facebook would always be free.

Is that still your objective?

"," Senator, yes. There will always be a version of Facebook that is free. It is our mission to try to help connect everyone around the world and to bring the world closer together.

In order to do that, we believe that we need to offer a service that everyone can afford, and we're committed to doing that.

"
Hatch," Well, if (ph) so, how do you sustain a business model in which users don't pay for your service?

"," Senator, we run ads.

"
Hatch," I see. That's great. Whenever a controversy like this arises, there's always the danger that Congress's response will be to step and overregulate. Now, that's been the experience that I've had, in my 42 years here.

In your view, what sorts of legislative changes would help to solve the problems the Cambridge Analytica story has revealed? And what sorts of legislative changes would not help to solve this issue?

"," Senator, I think that there are a few categories of legislation that -- that make sense to consider.

Around privacy specifically, there are a few principles that I think it would be useful to -- to discuss and potentially codified into law.

One is around having a simple and practical set of -- of ways that you explain what you are doing with data. And we talked a little bit earlier around the complexity of laying out these long privacy policies. It's hard to say that people fully understand something when it's only written out in a long legal document. This needs -- the stuff needs to be implemented in a way where people can actually understand it, where consumers can -- can understand it, but that can also capture all the nuances of how these services work in a way that doesn't -- that's not overly restrictive on --on providing the services. That's one.

The second is around giving people complete control. This is the most important principle for Facebook: Every piece of content that you share on Facebook, you own and you have complete control over who sees it and -- and how you share it, and you can remove it at any time.

That's why every day, about 100 billion times a day, people come to one of our services and either post a photo or send a message to someone, because they know that they have that control and that who they say it's going to go to is going to be who sees the content.

And I think that that control is something that's important that I think should apply to -- to every service.

And the third point is -- is just around enabling innovation. Because some of the abuse cases that -- that are very sensitive, like face recognition, for example -- and I feel there's a balance that's extremely important to strike here, where you obtain special consent for sensitive features like face recognition, but don't -- but we still need to make it so that American companies can innovate in those areas, or else we're going to fall behind Chinese competitors and others around the world who have different regimes for -- for different new features like that.

"
Grassley," Senator Cantwell?

SEN. MARIA CANTWELL (D-WASH): Thank you, Mr. Chairman.

Welcome Mr. Zuckerberg.

Do you know who Palantir is?

"," I do.

"
Cantwell," Some people refer to them as a Stanford Analytica. Do you agree?

"," Senator, I have not heard that.

"
